{
  "formatVersion": "cloud-agents-durable-coordination-registry/v1",
  "registryId": "cloud-agents/platform/durable-coordination",
  "sourceDigest": "sha256:041eeb4cdac568c48ff5e8f9f41a986259fcb89e16ee6b339802e25eca139d5e",
  "stateMachineDigest": "sha256:5c4fa5c0cfac253b45a41c2e49ee7e863b9efbe124e5d743e041f5e01f5c6f15",
  "policyDigest": "sha256:95023973eb007a958a3c5aea3ac61b6caa7cd8955b9a24fcef3ad269230c64e8",
  "stateMachines": [
    {
      "id": "cleanup/v1",
      "initialState": "none",
      "states": [
        "blocked",
        "complete",
        "draining",
        "none",
        "pending",
        "reaping",
        "revoking"
      ],
      "terminalStates": [
        "complete"
      ],
      "transitions": [
        {
          "from": "blocked",
          "event": "manual_recovery",
          "to": "pending"
        },
        {
          "from": "draining",
          "event": "block",
          "to": "blocked"
        },
        {
          "from": "draining",
          "event": "finish_drain",
          "to": "reaping"
        },
        {
          "from": "none",
          "event": "request_cleanup",
          "to": "pending"
        },
        {
          "from": "pending",
          "event": "begin_drain",
          "to": "draining"
        },
        {
          "from": "pending",
          "event": "begin_reap",
          "to": "reaping"
        },
        {
          "from": "pending",
          "event": "begin_revoke",
          "to": "revoking"
        },
        {
          "from": "pending",
          "event": "block",
          "to": "blocked"
        },
        {
          "from": "reaping",
          "event": "block",
          "to": "blocked"
        },
        {
          "from": "reaping",
          "event": "required_finalizers_succeeded",
          "to": "complete"
        },
        {
          "from": "revoking",
          "event": "block",
          "to": "blocked"
        },
        {
          "from": "revoking",
          "event": "finish_revoke_to_drain",
          "to": "draining"
        },
        {
          "from": "revoking",
          "event": "finish_revoke_to_reap",
          "to": "reaping"
        }
      ]
    },
    {
      "id": "finalizer/v1",
      "initialState": "pending",
      "states": [
        "claimed",
        "dead_letter",
        "pending",
        "retry_wait",
        "succeeded",
        "unknown"
      ],
      "terminalStates": [
        "dead_letter",
        "succeeded"
      ],
      "transitions": [
        {
          "from": "claimed",
          "event": "claim_outcome_unknown",
          "to": "unknown"
        },
        {
          "from": "claimed",
          "event": "fail_retryable",
          "to": "retry_wait"
        },
        {
          "from": "claimed",
          "event": "fail_terminal",
          "to": "dead_letter"
        },
        {
          "from": "claimed",
          "event": "succeed",
          "to": "succeeded"
        },
        {
          "from": "pending",
          "event": "claim",
          "to": "claimed"
        },
        {
          "from": "retry_wait",
          "event": "claim",
          "to": "claimed"
        },
        {
          "from": "unknown",
          "event": "reconcile_failure_retryable",
          "to": "retry_wait"
        },
        {
          "from": "unknown",
          "event": "reconcile_failure_terminal",
          "to": "dead_letter"
        },
        {
          "from": "unknown",
          "event": "reconcile_success",
          "to": "succeeded"
        }
      ]
    },
    {
      "id": "idempotency/v1",
      "initialState": "pending",
      "states": [
        "failed",
        "pending",
        "succeeded"
      ],
      "terminalStates": [
        "failed",
        "succeeded"
      ],
      "transitions": [
        {
          "from": "pending",
          "event": "record_failure",
          "to": "failed"
        },
        {
          "from": "pending",
          "event": "record_success",
          "to": "succeeded"
        }
      ]
    },
    {
      "id": "operation_attempt/v1",
      "initialState": "ready",
      "states": [
        "claimed",
        "failed",
        "ready",
        "succeeded",
        "unknown"
      ],
      "terminalStates": [
        "failed",
        "succeeded"
      ],
      "transitions": [
        {
          "from": "claimed",
          "event": "claim_outcome_unknown",
          "to": "unknown"
        },
        {
          "from": "claimed",
          "event": "persist_failed_receipt",
          "to": "failed"
        },
        {
          "from": "claimed",
          "event": "persist_succeeded_receipt",
          "to": "succeeded"
        },
        {
          "from": "ready",
          "event": "claim",
          "to": "claimed"
        },
        {
          "from": "unknown",
          "event": "reconcile_failed",
          "to": "failed"
        },
        {
          "from": "unknown",
          "event": "reconcile_succeeded",
          "to": "succeeded"
        }
      ]
    },
    {
      "id": "outbox/v1",
      "initialState": "pending",
      "states": [
        "claimed",
        "dead_letter",
        "delivered",
        "pending",
        "retry_wait"
      ],
      "terminalStates": [
        "dead_letter",
        "delivered"
      ],
      "transitions": [
        {
          "from": "claimed",
          "event": "delivery_failed_retryable",
          "to": "retry_wait"
        },
        {
          "from": "claimed",
          "event": "delivery_failed_terminal",
          "to": "dead_letter"
        },
        {
          "from": "claimed",
          "event": "delivery_succeeded",
          "to": "delivered"
        },
        {
          "from": "claimed",
          "event": "lease_expired_retryable",
          "to": "pending"
        },
        {
          "from": "claimed",
          "event": "lease_expired_terminal",
          "to": "dead_letter"
        },
        {
          "from": "pending",
          "event": "claim",
          "to": "claimed"
        },
        {
          "from": "retry_wait",
          "event": "claim",
          "to": "claimed"
        }
      ]
    },
    {
      "id": "platform_operation/v1",
      "initialState": "pending",
      "states": [
        "canceled",
        "failed",
        "pending",
        "reconciling",
        "running",
        "succeeded"
      ],
      "terminalStates": [
        "canceled",
        "failed",
        "succeeded"
      ],
      "transitions": [
        {
          "from": "pending",
          "event": "cancel_before_attempt",
          "to": "canceled"
        },
        {
          "from": "pending",
          "event": "start_attempt",
          "to": "running"
        },
        {
          "from": "reconciling",
          "event": "reconcile_failed_terminal",
          "to": "failed"
        },
        {
          "from": "reconciling",
          "event": "reconcile_retryable",
          "to": "pending"
        },
        {
          "from": "reconciling",
          "event": "reconcile_succeeded",
          "to": "succeeded"
        },
        {
          "from": "running",
          "event": "attempt_failed_retryable",
          "to": "pending"
        },
        {
          "from": "running",
          "event": "attempt_failed_terminal",
          "to": "failed"
        },
        {
          "from": "running",
          "event": "attempt_outcome_unknown",
          "to": "reconciling"
        },
        {
          "from": "running",
          "event": "attempt_succeeded",
          "to": "succeeded"
        }
      ]
    },
    {
      "id": "terminal_receipt/v1",
      "initialState": "absent",
      "states": [
        "absent",
        "persisted"
      ],
      "terminalStates": [
        "persisted"
      ],
      "transitions": [
        {
          "from": "absent",
          "event": "persist_terminal_receipt",
          "to": "persisted"
        }
      ]
    }
  ],
  "policies": {
    "audit": {
      "allowedFields": [
        "attempt_id",
        "database_timestamp",
        "fencing_token",
        "generation",
        "operation_id",
        "outcome",
        "profile_digest",
        "profile_id",
        "resource_id",
        "resource_kind",
        "resource_version",
        "stable_error_code",
        "subject_digest",
        "tenant_id",
        "transition"
      ],
      "forbiddenFields": [
        "authorization",
        "cookie",
        "credential",
        "pairing_token",
        "pairing_url",
        "private_key",
        "provider_payload",
        "raw_request",
        "raw_response",
        "refresh_token",
        "secret",
        "token_hash"
      ]
    },
    "cleanup": {
      "completeRule": "all_required_finalizers_succeeded",
      "manualRecoveryRule": "audited_manual_recovery_increment_recovery_generation",
      "stateMachineId": "cleanup/v1"
    },
    "finalizer": {
      "claimTuple": [
        "claim_holder_id",
        "claim_incarnation",
        "claim_token",
        "claim_expires_at"
      ],
      "identityFields": [
        "tenant_id",
        "operation_id",
        "operation_generation",
        "finalizer_name"
      ],
      "requiredDeadLetterRule": "block_cleanup",
      "stateMachineId": "finalizer/v1",
      "unknownRule": "reconciliation_required_no_direct_retry"
    },
    "idempotency": {
      "authorityFields": [
        "tenant_id",
        "subject_digest",
        "profile_id",
        "profile_digest",
        "idempotency_key"
      ],
      "clock": "database_transaction_timestamp",
      "deleteRule": "terminal_and_expired_and_unreferenced",
      "sameKeyDifferentDigest": "conflict_before_side_effect",
      "sameKeySameDigestPending": "return_in_progress_reference",
      "sameKeySameDigestTerminal": "return_redacted_terminal_envelope",
      "stateMachineId": "idempotency/v1",